title,url,category,filetype,slide_count,publishing_consultancy,description
"Strategic Marketing Plan Template",https://flevy.com/browse/marketplace/strategic-marketing-plan-template-676,"Strategy, Transformation, & Innovation",Word,35,"Documents & Files","Marketing plan template Word: Download this Strategic Marketing Plan Template (DOC) to build clear, actionable marketing strategies for consulting firms and businesses."
"Brand Assessment Tool",https://flevy.com/browse/marketplace/brand-assessment-tool-438,"Strategy, Transformation, & Innovation",Excel,,"Demand Metric","Brand assessment tool Excel template to evaluate and improve your brand’s strength. Download the XLS brand evaluation worksheet for actionable insights now."
"Business Board (Business Planning Tool)",https://flevy.com/browse/marketplace/business-board-business-planning-tool-1037,"Strategy, Transformation, & Innovation",Excel,,marijnmulders,"Optimize your business planning with the Business Board Excel template, crafted by industry experts. Capture key metrics, strategies, and financials on one page."
"SWOT Analysis - Driven Strategic Planning",https://flevy.com/browse/marketplace/swot-analysis-driven-strategic-planning-6350,"Strategy, Transformation, & Innovation",PowerPoint,114,"UJ Consulting","UJ Consulting"
"Vision, Mission, and Ambition",https://flevy.com/browse/marketplace/vision-mission-and-ambition-1963,"Strategy, Transformation, & Innovation",PowerPoint,8,AnyStrategy,"Difference between vision, mission, and ambition explained in this easy-to-use PPT template. Download Vision, Mission, and Ambition (PPTX) to clarify your strategy slides."
"Industry Analysis",https://flevy.com/browse/marketplace/industry-analysis-773,"Strategy, Transformation, & Innovation",PowerPoint,63,"Documents & Files","Industry Analysis PPT: Get detailed competitor audit, market landscape, and company analysis templates. Download actionable slides for automotive, retail, and business sectors."
"Plan for Performance Methodology",https://flevy.com/browse/marketplace/plan-for-performance-methodology-746,"Strategy, Transformation, & Innovation",PowerPoint,66,"Documents & Files","Explore the PLAN Methodology for dynamic strategic planning, crafted by ex-top-tier consultants. Enhance your business strategy with proven frameworks and insights."
"Shareholder Value Analysis",https://flevy.com/browse/marketplace/shareholder-value-analysis-734,"Strategy, Transformation, & Innovation",PowerPoint,53,"Documents & Files","Explore a comprehensive Shareholder Value Analysis by ex-McKinsey consultants, detailing ABC Auto's performance, growth strategies, and value creation roadmap."
"Key Performance Indicator (KPI) Strategies: Part 2",https://flevy.com/browse/flevypro/key-performance-indicator-kpi-strategies-part-2-4006,"Strategy, Transformation, & Innovation",PowerPoint,23,"LearnPPT Consulting","Explore advanced KPI strategies developed by ex-McKinsey & Big 4 consultants. Enhance growth and alignment with actionable insights and templates."
"Strong-form Product Management Model",https://flevy.com/browse/flevypro/strong-form-product-management-model-3776,"Strategy, Transformation, & Innovation",PowerPoint,24,"LearnPPT Consulting","Explore the Strong-form Product Management Model, crafted by ex-McKinsey and Big 4 consultants. Align strategy with execution through actionable insights and frameworks."
"Industry Analysis for Consultants",https://flevy.com/browse/flevypro/industry-analysis-for-consultants-3547,"Strategy, Transformation, & Innovation",PowerPoint,19,"LearnPPT Consulting","Industry analysis PPT for consultants: Get expert frameworks, examples, and strategic insights. Download this ready-to-use presentation to enhance your consulting projects."
"Maintaining Energy-to-Change",https://flevy.com/browse/flevypro/maintaining-energy-to-change-3173,"Strategy, Transformation, & Innovation",PowerPoint,21,"LearnPPT Consulting","Explore this PPT by ex-McKinsey and Big 4 consultants on maintaining Energy-to-Change for successful business transformations. Key strategies included."
"Scenario Planning Primer",https://flevy.com/browse/flevypro/scenario-planning-primer-3784,"Strategy, Transformation, & Innovation",PowerPoint,27,"LearnPPT Consulting","Explore this Scenario Planning Primer, crafted by ex-McKinsey & Big 4 consultants. Enhance strategic foresight with templates, insights, and best practices."
"IT Decision Making Framework",https://flevy.com/browse/flevypro/it-decision-making-framework-2884,"Strategy, Transformation, & Innovation",PowerPoint,20,"LearnPPT Consulting","Explore this IT Decision Making Framework by ex-McKinsey and Big 4 consultants. Optimize centralized vs. decentralized strategies for global IT governance."
"Global Talent Innovation",https://flevy.com/browse/flevypro/global-talent-innovation-3732,"Strategy, Transformation, & Innovation",PowerPoint,30,"LearnPPT Consulting","Explore the Global Talent Innovation Model by ex-McKinsey consultants. Transform talent strategies with actionable insights and a tailored approach for success."
"Purpose-driven Organization Transformation",https://flevy.com/browse/flevypro/purpose-driven-organization-transformation-2858,"Strategy, Transformation, & Innovation",PowerPoint,20,"LearnPPT Consulting","Explore a comprehensive framework for Purpose-driven transformation, crafted by ex-McKinsey and Big 4 consultants. Align, activate, and embed Purpose for lasting impact."
"Dimensions of Core Competence",https://flevy.com/browse/flevypro/dimensions-of-core-competence-2487,"Strategy, Transformation, & Innovation",PowerPoint,21,"PPT Lab","Core competence PPT: Learn the 4 key dimensions of core competencies and capabilities with clear frameworks. Download this professional presentation now."
"Sales Frameworks",https://flevy.com/browse/marketplace/sales-frameworks-8922,"Strategy, Transformation, & Innovation",PowerPoint,640,"SB Consulting ","This toolkit is created by trained McKinsey, BCG, and Porsche Consulting consultants and is the same used by MBB, Big 4, and Fortune 100 companies when performing Sales Initiatives."
"Mergers & Acquisitions &#40;M&A&#41; Financial Model",https://flevy.com/browse/marketplace/mergers-and-acquisitions-manda-financial-model-5593,"Strategy, Transformation, & Innovation",Excel,,"Profit Vision","This financial model is built by a certified Financial Modeling & Valuation Analyst with over 20+ years of global experience managing over $500MM+ in corporate finances."
"Net Promoter Score &#40;NPS&#41;",https://flevy.com/browse/marketplace/net-promoter-score-nps-3140,"Strategy, Transformation, & Innovation",PowerPoint,47,"Operational Excellence Consulting LLC","Developed by a Senior Executive and Operational Excellence Coach with experience at organizations including NOKIA, MICROVENTION, and MAGELLAN, this presentation covers the Net-Promoter-Score &#40;NPS&#41; and 10 Deployment Best Practices."
"Field Sales Tracker/Dashboard",https://flevy.com/browse/marketplace/field-sales-tracker-dashboard-79,"Strategy, Transformation, & Innovation",Excel,,giovanni,"Field Sales Tracker Dashboard Excel: Track field & telesales performance, sales pipeline, and campaign progress. Download this customizable sales management template."
"Silly Cow Exercise",https://flevy.com/browse/marketplace/silly-cow-exercise-5397,"Strategy, Transformation, & Innovation",PowerPoint,23,"Operational Excellence Consulting","Developed by a seasoned Design Thinking Consultant with a wealth of experience at industry giants like Microsoft and IBM, this exercise enhances team bonding and readies participants for tailored ideation sessions."
"33 High Performance Materials & Procurement KPIs",https://flevy.com/browse/marketplace/33-high-performance-materials-and-procurement-kpis-1586,"Strategy, Transformation, & Innovation",PowerPoint,34,SlideKraft,"Materials & Procurement KPIs PPT: Download 33 key performance indicators with formulas, measurement units, and trends to optimize procurement and materials management."
"Trade Promotions Management Framework",https://flevy.com/browse/marketplace/trade-promotions-management-framework-5228,"Strategy, Transformation, & Innovation",PowerPoint,36,Inyakwara,"Trade Promotions Management Framework PPT: Download a proven promo planning and execution guide with capability assessment tool to boost marketing ROI."
"Sales Negotiation Toolkit",https://flevy.com/browse/marketplace/sales-negotiation-toolkit-9400,"Strategy, Transformation, & Innovation",PowerPoint,1399,"SB Consulting ","This toolkit is created by trained McKinsey, BCG, and Porsche Consulting consultants and is the same used by MBB, Big 4, and Fortune 100 companies when performing Sales Initiatives."
"SWOT Analysis - Demystified",https://flevy.com/browse/marketplace/swot-analysis-demystified-7483,"Strategy, Transformation, & Innovation",PowerPoint,76,"RadVector  Consulting","Developed by a team of security experts with global consulting experience at McKinsey, Deloitte, and  Capgemini. It is a simplified approach to SWOT Analysis."
"KPI Business Development Manager",https://flevy.com/browse/marketplace/kpi-business-development-manager-8954,"Strategy, Transformation, & Innovation",Excel,,"UJ Consulting","Business Development KPI Excel template for managers. Track key performance indicators, monitor growth, and improve results with this ready-to-use XLSX file. Download now."
"Strategy Toolkit",https://flevy.com/browse/marketplace/strategy-toolkit-458,"Strategy, Transformation, & Innovation",PDF,98,noelhan90,"Enhance your strategic planning with this comprehensive toolkit featuring 50 essential frameworks and techniques, crafted by industry experts for effective analysis."
"Strategy Development Process - Mining Industry",https://flevy.com/browse/marketplace/strategy-development-process-mining-industry-1367,"Strategy, Transformation, & Innovation",PowerPoint,39,STRATICX,"Explore a comprehensive strategy development framework for the mining industry, crafted by industry experts. Enhance decision-making with in-depth analyses and strategic options."
"Sales and Marketing Alignment Tool",https://flevy.com/browse/marketplace/sales-and-marketing-alignment-tool-314,"Strategy, Transformation, & Innovation",Excel,,"Demand Metric","Sales and Marketing Alignment Tool Excel: Assess gaps, score alignment, and get actionable insights to improve collaboration between sales and marketing teams. Download now."
"Success Is System, Failure Is Component",https://flevy.com/browse/marketplace/success-is-system-failure-is-component-302,"Strategy, Transformation, & Innovation",PowerPoint,147,"Dr. Stephen Sweid","Explore strategic planning insights in this PPT by Dr. Stephen M. Sweid, a seasoned consultant. Learn to systematize success and mitigate SME failure."
"IT Due Diligence Exercise Template",https://flevy.com/browse/marketplace/it-due-diligence-exercise-template-278,"Strategy, Transformation, & Innovation",Word,16,"Dartview Consulting","IT Due Diligence Exercise Template by Dartview Consulting. Evaluate IT infrastructure for acquisitions with targeted inquiries across critical domains."
"Business Valuation Training Guide",https://flevy.com/browse/marketplace/business-valuation-training-guide-3760,"Strategy, Transformation, & Innovation",PowerPoint,62,"Corporate Finance 101","Master business valuation with this comprehensive training guide by industry experts. Explore DCF, market multiples, and key valuation drivers for informed decision-making."
"Valuation Training",https://flevy.com/browse/marketplace/valuation-training-777,"Strategy, Transformation, & Innovation",PowerPoint,164,"Documents & Files","Explore comprehensive valuation techniques in this PPT by industry experts. Ideal for financial analysts and consultants, it covers DCF, ROIC, and market multiples."
"Profit Pools Concept",https://flevy.com/browse/marketplace/profit-pools-concept-744,"Strategy, Transformation, & Innovation",PowerPoint,31,"Documents & Files","Explore the Profit Pools concept, crafted by industry experts, to enhance strategic decision-making and uncover profit opportunities across value chains."
"SWOT Diagrams & Slides 6",https://flevy.com/browse/marketplace/swot-diagrams-and-slides-6-1409,"Strategy, Transformation, & Innovation",PowerPoint,89,Marketingdocs,"Elevate your strategic presentations with these customizable SWOT slides, designed by industry experts. 88 projector-tested layouts for impactful analysis."
"Key Performance Indicators &#40;KPIs&#41; | IT Functions",https://flevy.com/browse/marketplace/key-performance-indicators-kpis-it-functions-8024,"Strategy, Transformation, & Innovation",PowerPoint,116,"ILMAM - Strategy & Management Consulting","MBB/Big 4 style presentation that provides a collection of 100+ Key Performance Indicators &#40;KPIs&#41; related to the Information Technology functions."
"Re-engagement after Restructuring",https://flevy.com/browse/flevypro/re-engagement-after-restructuring-5451,"Strategy, Transformation, & Innovation",PowerPoint,23,"LearnPPT Consulting","Explore a comprehensive framework for employee re-engagement post-restructuring, crafted by ex-McKinsey and Big 4 consultants. Enhance morale and productivity."
"Platform Business Models",https://flevy.com/browse/flevypro/platform-business-models-5647,"Strategy, Transformation, & Innovation",PowerPoint,31,"LearnPPT Consulting","Explore platform business models with insights from ex-McKinsey & Big 4 consultants. Analyze Integrator, Product, and MSP strategies for digital transformation."
"M&A Growth Strategy: Pre-deal Preparation",https://flevy.com/browse/flevypro/manda-growth-strategy-pre-deal-preparation-5680,"Strategy, Transformation, & Innovation",PowerPoint,21,"LearnPPT Consulting","M&A management presentation PPTX: Get expert M&A growth strategy and pre-deal preparation slides. Perfect for deal planning, slide decks, and strategy examples. Download now."
"M&A-driven Organizational Design",https://flevy.com/browse/flevypro/manda-driven-organizational-design-3203,"Strategy, Transformation, & Innovation",PowerPoint,21,"LearnPPT Consulting","Explore our M&A-driven Organizational Design framework, crafted by ex-McKinsey and Big 4 consultants. Navigate strategic planning, modeling, and implementation with actionable insights."
"Strategic Priorities Identification & Analysis",https://flevy.com/browse/flevypro/strategic-priorities-identification-and-analysis-6308,"Strategy, Transformation, & Innovation",PowerPoint,32,"LearnPPT Consulting","Explore a strategic framework by ex-McKinsey & Big 4 consultants for identifying and analyzing organizational priorities. Enhance clarity and execution."
"M&A - Fit for Growth",https://flevy.com/browse/flevypro/manda-fit-for-growth-3157,"Strategy, Transformation, & Innovation",PowerPoint,21,"LearnPPT Consulting","Explore the Fit for Growth framework, crafted by ex-McKinsey and Big 4 consultants, to align costs with strategy in M&A for sustainable growth."
"Go-to-Market Platform Design",https://flevy.com/browse/flevypro/go-to-market-platform-design-3744,"Strategy, Transformation, & Innovation",PowerPoint,25,"LearnPPT Consulting","Explore a comprehensive Go-to-Market Platform Design by ex-McKinsey and Big 4 consultants. Master GTM strategies with proven frameworks and templates."
"Alliance Development",https://flevy.com/browse/flevypro/alliance-development-3337,"Strategy, Transformation, & Innovation",PowerPoint,18,"LearnPPT Consulting","Explore strategic alliances with this comprehensive PPT by ex-McKinsey & Big 4 consultants. Enhance growth, market share, and competitive advantage."
"Four Approaches to Business Model Innovation (BMI)",https://flevy.com/browse/flevypro/four-approaches-to-business-model-innovation-bmi-2917,"Strategy, Transformation, & Innovation",PowerPoint,23,"LearnPPT Consulting","Business model innovation PPT: Learn the 4 key approaches to transform your business model. Download this detailed, ready-to-use presentation (PPT) now."
"Capabilities-Driven Strategy (CDS)",https://flevy.com/browse/flevypro/capabilities-driven-strategy-cds-3677,"Strategy, Transformation, & Innovation",PowerPoint,24,"LearnPPT Consulting","Explore the Capabilities-Driven Strategy (CDS) framework by ex-McKinsey consultants. Master capability alignment for operational excellence and sustained growth."
"4 Stages of Disruption",https://flevy.com/browse/flevypro/4-stages-of-disruption-5265,"Strategy, Transformation, & Innovation",PowerPoint,27,"LearnPPT Consulting","Explore the 4 Stages of Disruption framework by ex-McKinsey consultants. Gain insights into market evolution, strategic decision-making, and innovation dynamics."
"Multisided Platform &#40;MSP&#41; Strategy",https://flevy.com/browse/flevypro/multisided-platform-msp-strategy-5567,"Strategy, Transformation, & Innovation",PowerPoint,34,"PPT Lab","Explore a comprehensive MSP Strategy framework by ex-McKinsey & Big 4 consultants. Master critical decisions for platform success in the Digital Age."
"Strategy and Finance Alignment",https://flevy.com/browse/flevypro/strategy-and-finance-alignment-3684,"Strategy, Transformation, & Innovation",PowerPoint,22,"LearnPPT Consulting","Explore a strategic framework by ex-McKinsey & Big 4 consultants on aligning Finance with corporate strategy. Discover 5 key governance elements for optimal performance."
"Purpose-driven Analytics",https://flevy.com/browse/flevypro/purpose-driven-analytics-3959,"Strategy, Transformation, & Innovation",PowerPoint,26,"LearnPPT Consulting","Explore Purpose-driven Analytics, crafted by ex-McKinsey and Big 4 consultants. Learn to align data strategy with business goals for impactful decision-making."
"Value Creation Framework Series: Primer",https://flevy.com/browse/flevypro/value-creation-framework-series-primer-3911,"Strategy, Transformation, & Innovation",PowerPoint,28,"LearnPPT Consulting","Explore the Value Creation Framework, crafted by ex-McKinsey & Big 4 consultants. Enhance RTSR and bridge VBM gaps with actionable insights and templates."
"10 Sanity Tests for Strategy Development",https://flevy.com/browse/flevypro/10-sanity-tests-for-strategy-development-3324,"Strategy, Transformation, & Innovation",PowerPoint,23,"LearnPPT Consulting","Explore 10 Sanity Tests for Strategy Development, crafted by ex-McKinsey & Big 4 consultants. Enhance strategic robustness with proven frameworks and templates."
"Strategic Review Approach",https://flevy.com/browse/marketplace/strategic-review-approach-758,"Strategy, Transformation, & Innovation",PowerPoint,148,"Documents & Files","Explore a strategic review approach for a global food company, crafted by industry experts. Analyze market trends, evaluate options, and drive performance."
"Strategic Planning Core Competencies Toolkit",https://flevy.com/browse/marketplace/strategic-planning-core-competencies-toolkit-9058,"Strategy, Transformation, & Innovation",PowerPoint,557,"SB Consulting ","This toolkit is created by trained McKinsey, BCG, and Porsche Consulting consultants and is the same used by MBB, Big 4, and Fortune 100 companies when performing Strategy Initiatives."
"Strategy Offsite Planning Toolkit &#40;+Templates&#41;",https://flevy.com/browse/marketplace/strategy-offsite-planning-toolkit-templates-9442,"Strategy, Transformation, & Innovation",PowerPoint,941,"SB Consulting ","This toolkit is created by trained McKinsey, BCG, and Porsche Consulting consultants and is the same used by MBB, Big 4, and Fortune 100 companies when performing Strategy Initiatives."
"Automated Marketing Strategy",https://flevy.com/browse/marketplace/automated-marketing-strategy-8500,"Strategy, Transformation, & Innovation",PowerPoint,176,"SB Consulting ","This toolkit is created by trained McKinsey, BCG, and Porsche Consulting consultants and is the same used by MBB, Big 4, and Fortune 100 companies when performing Marketing Management Initiatives."
"Market Strategy Playbook",https://flevy.com/browse/marketplace/market-strategy-playbook-9537,"Strategy, Transformation, & Innovation",PowerPoint,1359,"SB Consulting ","This toolkit is created by trained McKinsey, BCG, and Porsche Consulting consultants and is the same used by MBB, Big 4, and Fortune 100 companies when performing Market Strategy Initiatives."
"250 Marketing & Sales Checklists",https://flevy.com/browse/marketplace/250-marketing-and-sales-checklists-9833,"Strategy, Transformation, & Innovation",PowerPoint,467,"SB Consulting ","This toolkit is created by trained McKinsey, BCG, and Porsche Consulting consultants and is the same used by MBB, Big 4, and Fortune 100 companies when performing Sales Initiatives."
"Exponential Organizations &#40;ExOs&#41;",https://flevy.com/browse/marketplace/exponential-organizations-exos-9158,"Strategy, Transformation, & Innovation",PowerPoint,112,"Operational Excellence Consulting","Developed by a seasoned Management Consultant &#40;ex-Microsoft and IBM&#41;, this deck is your key to mastering Exponential principles for unparalleled innovation and business success."
"100+ Sell-Side Mergers and Acquisitions &#40;M&A&#41; SOPs",https://flevy.com/browse/marketplace/100-sell-side-mergers-and-acquisitions-manda-sops-10098,"Strategy, Transformation, & Innovation",Excel,,"SB Consulting ","This toolkit is created by trained McKinsey, BCG, and Porsche Consulting consultants and is the same used by MBB, Big 4, and Fortune 100 companies when performing M&A Initiatives."
"Business Development In Projects - An Agile Toolkit",https://flevy.com/browse/marketplace/business-development-in-projects-an-agile-toolkit-6700,"Strategy, Transformation, & Innovation",PowerPoint,45,"RadVector  Consulting","Developed by a team of experts with global consulting experience at McKinsey, Deloitte, and  Capgemini."
"Business Valuation Matrix with Printable Visuals",https://flevy.com/browse/marketplace/business-valuation-matrix-with-printable-visuals-7150,"Strategy, Transformation, & Innovation",Excel,,"Jason Varner | SmartHelping","This valuation model was crafted by a Financial Modeler and Accountant with over 10+ years of global experience. He has served 750+ clients, from small family offices to billion-dollar corporations, across a multitude of industries."
"Sales KPI Dashboard",https://flevy.com/browse/marketplace/sales-kpi-dashboard-9822,"Strategy, Transformation, & Innovation",Excel,,"Improve Your Excel","Sales KPI template Excel: Track and analyze key sales metrics with this easy-to-use Sales KPI Dashboard (XLSX). Download now to boost your sales performance."
"SOP Team Performance Monitoring Meeting &#40;Example & Template&#41;",https://flevy.com/browse/marketplace/sop-team-performance-monitoring-meeting-example-and-template-6651,"Strategy, Transformation, & Innovation",Word,6,"UJ Consulting","SOP Team Performance Monitoring Meeting Template (docx): Download weekly agenda, meeting flowchart, and note forms to optimize team performance and continuous improvement."
"PESTEL/PESTLE Analysis Template and Report",https://flevy.com/browse/marketplace/pestel-pestle-analysis-template-and-report-5261,"Strategy, Transformation, & Innovation",Excel,,"Navigate Change Consulting","PESTEL/PESTLE Analysis Template Excel: Download this detailed environmental analysis tool covering Political, Economic, Social, Technological, Environmental, and Legal factors."
"Mergers & Acquisitions Best Practices &#40;1000+ Best Practices&#41;",https://flevy.com/browse/marketplace/mergers-and-acquisitions-best-practices-1000-best-practices-9457,"Strategy, Transformation, & Innovation",PowerPoint,1724,"SB Consulting ","This toolkit is created by trained McKinsey, BCG, and Porsche Consulting consultants and is the same used by MBB, Big 4, and Fortune 100 companies when performing M&A Initiatives."
"Digital Transformation Self-Assessment Toolkit &#40;450+ KPIs&#41;",https://flevy.com/browse/marketplace/digital-transformation-self-assessment-toolkit-450-kpis-9179,"Strategy, Transformation, & Innovation",PowerPoint,1112,"SB Consulting ","This toolkit is created by trained McKinsey, BCG, and Porsche Consulting consultants and is the same used by MBB, Big 4, and Fortune 100 companies when performing Digital Transformation Initiatives."
"Service Design &#40;Design Thinking for Services&#41;",https://flevy.com/browse/marketplace/service-design-design-thinking-for-services-5264,"Strategy, Transformation, & Innovation",PowerPoint,143,"Operational Excellence Consulting","Developed by a Design Thinking Consultant with global experience at industry giants like Microsoft and IBM, this presentation is your gateway to elevating service excellence and maximizing customer satisfaction."
"Executive Team Building",https://flevy.com/browse/marketplace/executive-team-building-1408,"Strategy, Transformation, & Innovation",PowerPoint,38,"McCarthy & Affiliates","Enhance executive performance with this comprehensive PPT on Team Building, crafted by an experienced consultant. Optimize strategy, alignment, and outcomes."
"Strategic Planning PowerPoint Template",https://flevy.com/browse/marketplace/strategic-planning-powerpoint-template-2356,"Strategy, Transformation, & Innovation",PowerPoint,78,Marketingdocs,"Elevate your strategic planning with this comprehensive PPT template, crafted by industry experts. Features 76 slides, including SWOT, BCG Matrix, and more."
"HR Competency Framework",https://flevy.com/browse/marketplace/hr-competency-framework-5540,"Strategy, Transformation, & Innovation",PowerPoint,10,"Corporate Finance 101","Competency framework for HR professionals PPT: Download a ready-to-use HR Competency Framework template to define skills, behaviors, and roles clearly. Get it now."
"M&A Investment Teaser Template",https://flevy.com/browse/marketplace/manda-investment-teaser-template-4024,"Strategy, Transformation, & Innovation",PowerPoint,7,"Corporate Finance 101","Investment teaser template PPTX for M&A deals. Get a professional, ready-to-use M&A investment teaser presentation to attract investors and close deals faster."
