title,url,category,filetype,slide_count,publishing_consultancy,description
"Performance Management Primer",https://flevy.com/browse/flevypro/performance-management-primer-2484,"Organization, Change, & HR",PowerPoint,15,"PPT Lab","Performance management PPT: Learn key frameworks, training slides, and the full performance management cycle. Download this expert Performance Management Primer now."
"Influence Model for Change",https://flevy.com/browse/flevypro/influence-model-for-change-3658,"Organization, Change, & HR",PowerPoint,23,"LearnPPT Consulting","Explore the Influence Model for Change, crafted by ex-McKinsey & Big 4 consultants. This PPT outlines key actions for effective transformation management."
"Closing the Strategy-to-Performance Gap",https://flevy.com/browse/flevypro/closing-the-strategy-to-performance-gap-2760,"Organization, Change, & HR",PowerPoint,20,"PPT Lab","Explore a framework by ex-McKinsey & Big 4 consultants to close the Strategy-to-Performance Gap. Learn 7 actionable rules for enhanced execution."
"Virtual Teams: Challenges & Benefits",https://flevy.com/browse/flevypro/virtual-teams-challenges-and-benefits-4013,"Organization, Change, & HR",PowerPoint,26,"LearnPPT Consulting","Explore effective strategies for managing Virtual Teams in this PPT by ex-McKinsey and Big 4 consultants. Enhance productivity and tackle key challenges."
"Fit Transformation: Strong, Agile, Lean",https://flevy.com/browse/flevypro/fit-transformation-strong-agile-lean-3015,"Organization, Change, & HR",PowerPoint,24,"LearnPPT Consulting","Explore the Fit Transformation framework by ex-McKinsey consultants. Align strategy, enhance agility, and drive sustainable results in your organization."
"Target Operating Model &#40;TOM&#41; Core Competencies &#40;600 KPIs&#41;",https://flevy.com/browse/marketplace/target-operating-model-tom-core-competencies-600-kpis-9201,"Organization, Change, & HR",PowerPoint,1115,"SB Consulting ","This toolkit is created by trained McKinsey, BCG, and Porsche Consulting consultants and is the same used by MBB, Big 4, and Fortune 100 companies when performing Business Model Initiatives."
"Policy Governance and Management Best Practices",https://flevy.com/browse/marketplace/policy-governance-and-management-best-practices-6173,"Organization, Change, & HR",PowerPoint,51,"Patrick Gitau ","Policy Governance and Management Best Practices PPT: Learn effective corporate policy development, risk management, and compliance frameworks. Download now."
"Change Management Strategy: Software Implementation",https://flevy.com/browse/marketplace/change-management-strategy-software-implementation-8171,"Organization, Change, & HR",PowerPoint,32,"Gafford Consulting","Created by a Senior IT Change Manager with experience working with Deloitte, PwC, EY, US Fortune 500 organizations and Global Brands.  15 Plus years delivering on Change Management Strategies."
"ESG Toolkit",https://flevy.com/browse/marketplace/esg-toolkit-8332,"Organization, Change, & HR",PowerPoint,178,"SB Consulting ","This toolkit is created by trained McKinsey, BCG, and Porsche Consulting consultants and is the same used by MBB, Big 4, and Fortune 100 companies when performing ESG Initiatives."
"Team Management Models",https://flevy.com/browse/marketplace/team-management-models-1212,"Organization, Change, & HR",PowerPoint,128,"Operational Excellence Consulting","Developed by a Change Management Expert with a wealth of experience at industry giants like Microsoft, IBM and Panasonic, this collection serves as your guide to achieving transformative change and enhancing stakeholder satisfaction."
"PMO - Performance Management Plan",https://flevy.com/browse/flevypro/pmo-performance-management-plan-2430,"Organization, Change, & HR",Excel,,Flevy,"Performance management template Excel: Download the PMO Performance Management Plan XLS for tracking KPIs, scorecards, and improving project outcomes efficiently."
"Change Management Toolkit",https://flevy.com/browse/marketplace/change-management-toolkit-7248,"Organization, Change, & HR",PowerPoint,286,"SB Consulting ","These templates are created by trained McKinsey, BCG, and Porsche Consulting consultants and are the same used by MBB, Big 4, and Fortune 100 companies when performing Change Management Initiatives."
"Corporate Governance Frameworks",https://flevy.com/browse/marketplace/corporate-governance-frameworks-5355,"Organization, Change, & HR",PowerPoint,113,"Operational Excellence Consulting","Developed by a Management Consultant with global experience at Microsoft and IBM, this collection serves as your resource for Corporate Governance Frameworks, fostering sustainability excellence and enhancing stakeholder satisfaction."
"Silly Cow Exercise",https://flevy.com/browse/marketplace/silly-cow-exercise-5397,"Organization, Change, & HR",PowerPoint,23,"Operational Excellence Consulting","Developed by a seasoned Design Thinking Consultant with a wealth of experience at industry giants like Microsoft and IBM, this exercise enhances team bonding and readies participants for tailored ideation sessions."
"Strategic Key Performance Indicators (KPIs)",https://flevy.com/browse/flevypro/strategic-key-performance-indicators-kpis-4031,"Organization, Change, & HR",PowerPoint,23,"LearnPPT Consulting","Explore strategic KPIs with insights from ex-McKinsey & Big 4 consultants. Enhance performance, drive automation, and optimize decision-making for success."
"5S Implementation Guidebook: 8 Steps of 5S Implementation",https://flevy.com/browse/marketplace/5s-implementation-guidebook-8-steps-of-5s-implementation-3178,"Organization, Change, & HR",PowerPoint,162,"Operational Excellence Consulting","Developed by a seasoned Certified Lean Six Sigma Black Belt with a proven track record at Microsoft, IBM and Panasonic, this comprehensive presentation is your pathway to achieving Operational Excellence through Lean Methodologies."
"Change Management - Process Guide &#40;ITSM, ISO 20000&#41;",https://flevy.com/browse/marketplace/change-management-process-guide-itsm-iso-20000-3864,"Organization, Change, & HR",Word,54,"ITSM Consulting","Change Management process guide (DOCX) for ITSM & ISO 20000. Learn key steps, workflows, and best practices to align IT services. Download now."
"Capability Maturity Model (CMM) - Enterprise Architecture",https://flevy.com/browse/flevypro/capability-maturity-model-cmm-enterprise-architecture-2949,"Organization, Change, & HR",PowerPoint,24,"LearnPPT Consulting","Explore the Capability Maturity Model (CMM) for Enterprise Architecture, crafted by ex-McKinsey and Big 4 consultants. Elevate your EA maturity with this expert PPT."
"Key Performance Indicators (KPIs): 5 Areas of Focus",https://flevy.com/browse/flevypro/key-performance-indicators-kpis-5-areas-of-focus-4033,"Organization, Change, & HR",PowerPoint,22,"LearnPPT Consulting","Key Performance Indicators (KPIs) PPT: Focus on 5 critical areas to measure success. Get a ready-to-use presentation template for healthcare, projects, and corporate strategy."
"Workshop Facilitation Techniques (Volume 2)",https://flevy.com/browse/flevypro/workshop-facilitation-techniques-volume-2-3849,"Organization, Change, & HR",PowerPoint,27,"LearnPPT Consulting","Explore advanced Workshop Facilitation Techniques developed by ex-McKinsey and Big 4 consultants. Enhance engagement and drive results in strategic sessions."
"DICE Hard Change Factors",https://flevy.com/browse/flevypro/dice-hard-change-factors-2656,"Organization, Change, & HR",PowerPoint,12,"PPT Lab","Dice framework PPT: Learn BCG’s DICE model for change management. Get clear slides on Hard Change Factors to assess and drive successful transformations. Download now."
"Innovation Culture",https://flevy.com/browse/flevypro/innovation-culture-3674,"Organization, Change, & HR",PowerPoint,22,"LearnPPT Consulting","Developed by ex-McKinsey & Big 4 consultants, this PPT outlines 5 key behaviors to foster a Culture of Innovation in your organization."
"Removing Organizational Silos",https://flevy.com/browse/flevypro/removing-organizational-silos-3861,"Organization, Change, & HR",PowerPoint,23,"LearnPPT Consulting","Explore effective strategies to dismantle organizational silos for successful transformation. Created by ex-McKinsey consultants, this PPT offers actionable insights and templates."
"HSE Incident Trend Analysis Excel Report",https://flevy.com/browse/marketplace/hse-incident-trend-analysis-excel-report-9032,"Organization, Change, & HR",Excel,,"Improve Your Excel","HSE Incident Trend Analysis Excel Report: Download a ready-to-use template for tracking, analyzing, and reporting safety incidents. Streamline your HSE monthly and weekly reports."
"Objective, Goals, Strategies And Measures &#40;OGSM&#41;",https://flevy.com/browse/marketplace/objective-goals-strategies-and-measures-ogsm-8069,"Organization, Change, & HR",PowerPoint,115,"SB Consulting ","This toolkit is created by trained McKinsey, BCG, and Porsche Consulting consultants and is the same used by MBB, Big 4, and Fortune 100 companies when performing Strategic Management Initiatives."
"TWI Program: Job Relations &#40;JR&#41; Training",https://flevy.com/browse/marketplace/twi-program-job-relations-jr-training-613,"Organization, Change, & HR",PowerPoint,97,"Operational Excellence Consulting","Developed by a seasoned TWI Master Trainer with a proven track record at Microsoft, IBM and Panasonic, this presentation is your gateway to mastering TWI Job Relations for achieving Operational Excellence through Lean Methodologies."
"TWI Program: Job Methods &#40;JM&#41; Training",https://flevy.com/browse/marketplace/twi-program-job-methods-jm-training-1505,"Organization, Change, & HR",PowerPoint,105,"Operational Excellence Consulting","Developed by a seasoned TWI Master Trainer with a proven track record at Microsoft, IBM and Panasonic, this presentation is your gateway to mastering TWI Job Methods for achieving Operational Excellence through Lean Methodologies."
"The 7 Habits of Highly Effective People - Framework & Diagram",https://flevy.com/browse/marketplace/the-7-habits-of-highly-effective-people-framework-and-diagram-6535,"Organization, Change, & HR",PowerPoint,50,"UJ Consulting","7 Habits of Highly Effective People PPT: Get Stephen Covey’s proven framework & diagram to boost productivity and leadership. Download the editable PowerPoint now."
"Human Resource Strategy",https://flevy.com/browse/marketplace/human-resource-strategy-6759,"Organization, Change, & HR",Word,18,"UJ Consulting","Develop a robust HR strategy with this expert guide by UJ Consulting. Align HR goals with business objectives using proven frameworks and metrics."
"Stacey Matrix",https://flevy.com/browse/flevypro/stacey-matrix-8417,"Organization, Change, & HR",PowerPoint,30,"LearnPPT Consulting","Explore the Stacey Matrix, crafted by ex-McKinsey & Big 4 consultants, to enhance decision-making in complex environments. Ideal for strategic leaders."
"Building Blocks of Behavioral Strategy",https://flevy.com/browse/flevypro/building-blocks-of-behavioral-strategy-3403,"Organization, Change, & HR",PowerPoint,29,"LearnPPT Consulting","Explore cognitive biases in strategic decision-making with insights from ex-McKinsey and Big 4 consultants. Enhance corporate performance with actionable frameworks."
"Leadership Presence",https://flevy.com/browse/flevypro/leadership-presence-4035,"Organization, Change, & HR",PowerPoint,23,"LearnPPT Consulting","Enhance your Leadership Presence with this PPT by ex-McKinsey consultants. Discover 10 core principles to inspire, engage, and build trust effectively."
"Family Business: Governance",https://flevy.com/browse/flevypro/family-business-governance-3786,"Organization, Change, & HR",PowerPoint,22,"LearnPPT Consulting","Explore a governance framework for family businesses, crafted by ex-McKinsey & Big 4 consultants. Understand 7 core elements for sustainable success."
"4 Types of Corporate Culture",https://flevy.com/browse/flevypro/4-types-of-corporate-culture-3478,"Organization, Change, & HR",PowerPoint,22,"LearnPPT Consulting","Corporate culture PPT: Learn the 4 types of corporate culture with clear examples. Perfect for company culture presentations and organizational culture training. Download now."
"FAST Method to Goal Setting",https://flevy.com/browse/flevypro/fast-method-to-goal-setting-3647,"Organization, Change, & HR",PowerPoint,19,"LearnPPT Consulting","Goal setting PPT: Learn the FAST Method to set and achieve goals quickly. Includes clear slides for training, workshops, and strategy alignment. Download the PPT now."
"Knowledge Management Primer",https://flevy.com/browse/flevypro/knowledge-management-primer-3797,"Organization, Change, & HR",PowerPoint,26,"LearnPPT Consulting","Knowledge Management PPT: Learn key components, processes, tools, and benefits of knowledge management. Download this detailed Knowledge Management Primer (PPT) now."
"First 90 Days - Critical Success Strategies",https://flevy.com/browse/flevypro/first-90-days-critical-success-strategies-3223,"Organization, Change, & HR",PowerPoint,19,"LearnPPT Consulting","Explore 14 critical success strategies for new leaders to navigate transitions effectively. Created by an ex-McKinsey consultant, this PPT offers actionable insights."
"Best Practice Guide for Effective Compliance Management",https://flevy.com/browse/marketplace/best-practice-guide-for-effective-compliance-management-10965,"Organization, Change, & HR",PowerPoint,70,"Patrick Gitau ","Expert passionately  seeking to build Governance  capacity worldwide"
"Training Within Industry &#40;TWI&#41; Frameworks",https://flevy.com/browse/marketplace/training-within-industry-twi-frameworks-2414,"Organization, Change, & HR",PowerPoint,63,"Operational Excellence Consulting","Developed by a seasoned TWI Master Trainer with global experience at Microsoft, IBM and Panasonic, this collection serves as your resource for TWI Frameworks, enabling operational excellence and enhancing stakeholder satisfaction."
"9 Influencing Strategies Used by the Most Successful Leaders",https://flevy.com/browse/marketplace/9-influencing-strategies-used-by-the-most-successful-leaders-1346,"Organization, Change, & HR",PowerPoint,47,SlideKraft,"Explore 9 key influencing strategies for leaders, crafted by experts. Enhance your leadership effectiveness with actionable insights and practical examples."
"Assessment Dashboard - Capability Maturity Model &#40;CMM&#41;",https://flevy.com/browse/marketplace/assessment-dashboard-capability-maturity-model-cmm-3153,"Organization, Change, & HR",Excel,,"Gerard Blokdijk","Enhance your CMM expertise with this Excel-based Self-Assessment Dashboard. Created by industry experts, it streamlines CMM evaluations for effective decision-making."
"10 Principles of Organizational Design",https://flevy.com/browse/flevypro/10-principles-of-organizational-design-5929,"Organization, Change, & HR",PowerPoint,25,"LearnPPT Consulting","Principles of organisation PPT: Learn the 10 key principles of organizational design with this clear, actionable PowerPoint template. Download the PPTX now."
"Executive Decision Making Acumen",https://flevy.com/browse/flevypro/executive-decision-making-acumen-6142,"Organization, Change, & HR",PowerPoint,25,"LearnPPT Consulting","Enhance executive decision-making with this PPT, crafted by ex-McKinsey & Big 4 consultants. Explore the Strategic Choice Cascade for aligned, impactful choices."
"Tension Management",https://flevy.com/browse/flevypro/tension-management-5922,"Organization, Change, & HR",PowerPoint,29,"LearnPPT Consulting","Explore a framework by ex-McKinsey and Big 4 consultants for managing Performance Tensions in high-pressure environments. Transform conflict into productivity."
"Organizational Design Maturity Model &#40;ODMM&#41;",https://flevy.com/browse/flevypro/organizational-design-maturity-model-odmm-7870,"Organization, Change, & HR",PowerPoint,33,"LearnPPT Consulting","ODMM PPTX: Learn the Organizational Design Maturity Model to assess and improve your org structure. Download this detailed PPT template now."
"Decision Support Tools",https://flevy.com/browse/flevypro/decision-support-tools-5653,"Organization, Change, & HR",PowerPoint,27,"LearnPPT Consulting","Explore essential Decision Support Tools for strategic decision-making, crafted by ex-McKinsey and Big 4 consultants. Enhance decision accuracy with proven frameworks."
"HR Digital Transformation",https://flevy.com/browse/marketplace/hr-digital-transformation-6441,"Organization, Change, & HR",PowerPoint,29,"UJ Consulting","HR Digital Transformation PPT: Learn key strategies, HR automation, and process improvements. Download this expert-ready presentation to drive your HR digital roadmap."
"Key Business Processes | Risk and Compliance",https://flevy.com/browse/marketplace/key-business-processes-risk-and-compliance-8145,"Organization, Change, & HR",PowerPoint,13,"ILMAM - Strategy & Management Consulting","MBB/Big 4 style presentation that provides a taxonomy of key business processes related to managing enterprise risk, compliance, remediation, and resiliency"
"Human Resources Strategy Framework: Business Value Creation",https://flevy.com/browse/marketplace/human-resources-strategy-framework-business-value-creation-1972,"Organization, Change, & HR",PowerPoint,101,"Youssef AIT AKKI - The Horizon Strategy.","Explore our HR Strategy Framework PPT, crafted by industry experts, to align human capital with business goals and drive value creation in your organization."
"Business Model Innovation &#40;BMI&#41;: Business Model Journey",https://flevy.com/browse/flevypro/business-model-innovation-bmi-business-model-journey-6129,"Organization, Change, & HR",PowerPoint,29,"LearnPPT Consulting","Explore the Business Model Innovation (BMI) framework by ex-McKinsey and Big 4 consultants. Understand the Business Model Journey and key components for sustainable growth."
"Workshop Facilitation Techniques (Volume 1)",https://flevy.com/browse/flevypro/workshop-facilitation-techniques-volume-1-3848,"Organization, Change, & HR",PowerPoint,28,"LearnPPT Consulting","Explore essential Workshop Facilitation Techniques by ex-McKinsey consultants to enhance engagement and drive effective group outcomes. Ideal for leaders."
"Board Governance Models",https://flevy.com/browse/flevypro/board-governance-models-3386,"Organization, Change, & HR",PowerPoint,25,"LearnPPT Consulting","Explore essential Board Governance Models in this expert PPT by an ex-McKinsey consultant. Enhance clarity, optimize roles, and drive corporate excellence."
"Matrix Organization: Balance of Power",https://flevy.com/browse/flevypro/matrix-organization-balance-of-power-3477,"Organization, Change, & HR",PowerPoint,27,"LearnPPT Consulting","Explore the intricacies of Matrix Organizations with insights on power dynamics from an ex-McKinsey consultant. Optimize efficiency and collaboration with practical templates."
"Strategy Classics: Balanced Scorecard (BSC)",https://flevy.com/browse/flevypro/strategy-classics-balanced-scorecard-bsc-1969,"Organization, Change, & HR",PowerPoint,30,"LearnPPT Consulting","Balanced Scorecard PPT: Download the classic Strategy Balanced Scorecard template (BSC) for PowerPoint. Includes examples and slides to build your performance review."
"Value Mapping",https://flevy.com/browse/flevypro/value-mapping-2659,"Organization, Change, & HR",PowerPoint,19,"PPT Lab","Explore Value Mapping, a framework by ex-McKinsey consultants, designed to align performance metrics with stakeholder needs for sustainable value creation."
"ISO 37301:2021 &#40;Compliance Management Systems&#41; Awareness",https://flevy.com/browse/marketplace/iso-373012021-compliance-management-systems-awareness-6033,"Organization, Change, & HR",PowerPoint,74,"Operational Excellence Consulting","Developed by an ex-ISO Management System Lead Auditor with a wealth of experience at industry leaders like Microsoft and IBM, this presentation helps to raise ISO 37301 awareness and enhance compliance and ethics for business excellence."
"Problem Solving and Decision Making",https://flevy.com/browse/marketplace/problem-solving-and-decision-making-5369,"Organization, Change, & HR",PowerPoint,101,"Gafford Consulting","Enhance decision-making skills with this expert-led workshop by Gafford Consulting. Learn structured problem-solving techniques and avoid common pitfalls."
"Communication Workbook",https://flevy.com/browse/marketplace/communication-workbook-740,"Organization, Change, & HR",Excel,,"Documents & Files","Optimize your communication strategy with this Excel-based workbook, crafted by industry experts. Streamline stakeholder management and enhance project success."
"Form 003 Pre Start Briefing",https://flevy.com/browse/marketplace/form-003-pre-start-briefing-343,"Organization, Change, & HR",Word,2,gmclennan,"Pre start briefing template DOC for daily safety and shift meetings. Download Form 003 to streamline health and safety briefings and pre-job checklists."
"Executive Dashboard Toolkit",https://flevy.com/browse/marketplace/executive-dashboard-toolkit-9668,"Organization, Change, & HR",PowerPoint,200,"Domont Consulting","This toolkit was created by ex-McKinsey, Deloitte and BCG Strategy Consultants. It includes 160 Charts, Visuals + Financial Models in Excel & PPT + 18 min of Video Training."
"Managerial Grid Model",https://flevy.com/browse/flevypro/managerial-grid-model-3737,"Organization, Change, & HR",PowerPoint,25,"LearnPPT Consulting","Managerial Grid Theory of Leadership PPT by Blake & Mouton. Learn leadership styles, grid model insights & examples. Download the professional PowerPoint now."
"AI Maturity Transformation Journey",https://flevy.com/browse/flevypro/ai-maturity-transformation-journey-10913,"Organization, Change, & HR",PowerPoint,28,"LearnPPT Consulting","AI Maturity Transformation Journey PPT: Learn key steps for scalable AI leadership, including portfolio management, infrastructure, governance, and Responsible AI frameworks."
"Organizational Ambidexterity Framework",https://flevy.com/browse/flevypro/organizational-ambidexterity-framework-9530,"Organization, Change, & HR",PowerPoint,37,"LearnPPT Consulting","Explore the Organizational Ambidexterity Framework by ex-McKinsey & Big 4 consultants. Master dual strategies for innovation & efficiency in your organization."
"AI Maturity Model",https://flevy.com/browse/flevypro/ai-maturity-model-10800,"Organization, Change, & HR",PowerPoint,32,"LearnPPT Consulting","AI Maturity Model PPT: Diagnose AI adoption stages from stagnation to leadership. Includes frameworks and slide templates to assess AI impact. Download now."
"How to Conduct Consulting Interviews",https://flevy.com/browse/marketplace/how-to-conduct-consulting-interviews-743,"Organization, Change, & HR",PowerPoint,32,"Documents & Files","Master consulting interviews with this expert PPT guide. Created by industry veterans, it covers planning, execution, and synthesis for impactful insights."
"6 Pillars of Talent Management",https://flevy.com/browse/flevypro/6-pillars-of-talent-management-5271,"Organization, Change, & HR",PowerPoint,25,"LearnPPT Consulting","Talent management framework PPT: Learn the 6 Pillars of Talent Management with this strategic PowerPoint. Download to master best practices, models, and challenges."
"Time-to-Value Management",https://flevy.com/browse/flevypro/time-to-value-management-3363,"Organization, Change, & HR",PowerPoint,24,"LearnPPT Consulting","Explore the Talent-to-Value Management framework by ex-McKinsey & Big 4 consultants. Align talent with value through a 4-step strategic approach."
"4 Areas of Strategic Governance for New Board Members",https://flevy.com/browse/flevypro/4-areas-of-strategic-governance-for-new-board-members-3783,"Organization, Change, & HR",PowerPoint,24,"LearnPPT Consulting","Explore strategic governance with insights from ex-McKinsey & Big 4 consultants. This PPT outlines 4 key areas and 12 critical questions for new Directors."
"Aon Hewitt Employee Engagement Model",https://flevy.com/browse/flevypro/aon-hewitt-employee-engagement-model-2677,"Organization, Change, & HR",PowerPoint,21,"PPT Lab","Drivers of employee engagement PPT: Explore the Aon Hewitt Employee Engagement Model with clear framework slides. Download this PPTX to enhance your engagement strategy."
"Corporate Social Responsibility (CSR) Opportunities",https://flevy.com/browse/flevypro/corporate-social-responsibility-csr-opportunities-3940,"Organization, Change, & HR",PowerPoint,21,"LearnPPT Consulting","Corporate Social Responsibility examples PPT: Explore CSR opportunities, sustainability, and corporate philanthropy. Download this detailed CSR presentation now."
"McKinsey Organizational Structure Framework",https://flevy.com/browse/marketplace/mckinsey-organizational-structure-framework-7639,"Organization, Change, & HR",PowerPoint,237,"SB Consulting ","This toolkit is created by trained McKinsey, BCG, and Porsche Consulting consultants and is the same used by MBB, Big 4, and Fortune 100 companies when performing Organizational Design Initiatives."
"Create an Organizational Change Management Plan",https://flevy.com/browse/marketplace/create-an-organizational-change-management-plan-6291,"Organization, Change, & HR",PowerPoint,49,"RadVector  Consulting","Developed by a team of  experts with global consulting experience at McKinsey, Deloitte, and  Capgemini."
"McKinsey Talent-to-Value Framework",https://flevy.com/browse/marketplace/mckinsey-talent-to-value-framework-7699,"Organization, Change, & HR",PowerPoint,230,"SB Consulting ","This toolkit is created by trained McKinsey, BCG, and Porsche Consulting consultants and is the same used by MBB, Big 4, and Fortune 100 companies when performing Talent Management Initiatives."
